product,name,brand,price,discount_percent,rating,n_comments,image,express_delivery,ecommerce
zapatillas,St Runner V2 NL Zapatillas de Deporte Hombre,PUMA,45.0,18.0,4.5,10091,https://m.media-amazon.com/images/I/71SRN28kwJL._AC_UL320_.jpg,True,AMZ
zapatillas,Royal Cl Jogger 3 Zapatillas Unisex Adulto,Reebok,50.0,0,4.4,267,https://m.media-amazon.com/images/I/61X3y8ou8hL._AC_UL320_.jpg,True,AMZ
zapatillas,Doheny Platform Sneakers Mujer,Vans,56.71,24.0,4.6,10726,https://m.media-amazon.com/images/I/71NodGGRhWL._AC_UL320_.jpg,True,AMZ
zapatillas,43742 Zapatillas Mujer,XTI,41.28,17.0,5.0,1,https://m.media-amazon.com/images/I/61xLRVcvWrL._AC_UL320_.jpg,False,AMZ
zapatillas,All Star Ox Zapatillas Amarillas Limón,Converse,49.95,7.0,4.5,11486,https://m.media-amazon.com/images/I/61Hvw6OwwGL._AC_UL320_.jpg,True,AMZ
zapatillas,Bastogne Zapatillas Mujer,GIOSEPPO,64.95,0,4.7,465,https://m.media-amazon.com/images/I/51IL+ePxSDL._AC_UL320_.jpg,True,AMZ
zapatillas,Malibu Beach S Zapatillas Mujer,Levi's,31.07,11.0,4.4,1591,https://m.media-amazon.com/images/I/61HNASlq0-L._AC_UL320_.jpg,True,AMZ
zapatillas,Ua Charged Pursuit 2 Bl - Zapatos para Correr Hombre,Under Armour,29.97,50.0,4.4,236,https://m.media-amazon.com/images/I/71ZhqflZsWS._AC_UL320_.jpg,True,AMZ
zapatillas,W Revolution 6 Nn Zapatillas para Correr Mujer,NIKE,36.57,0,4.4,133,https://m.media-amazon.com/images/I/71dmrDvvyVL._AC_UL320_.jpg,True,AMZ
zapatillas,Shorts Dri-Fit Essential Zapatillas Hombre,NIKE,49.79,23.0,4.5,14760,https://m.media-amazon.com/images/I/71BBDcvgL1L._AC_UL320_.jpg,True,AMZ
zapatillas,Mandriles Blanca M9165 Beige Crema CT AS SP OX,Converse,51.38,27.0,4.5,15583,https://m.media-amazon.com/images/I/51PbnHuHt0L._AC_UL320_.jpg,True,AMZ
zapatillas,Aart Iberia Sneakers Hombre,Levi's,39.95,19.0,4.3,171,https://m.media-amazon.com/images/I/71XCGMGsoEL._AC_UL320_.jpg,True,AMZ
zapatillas,Track-scloric 52631-bkrd Zapatillas Hombre,Skechers,42.98,31.0,4.5,2334,https://m.media-amazon.com/images/I/81FAZrs8JIS._AC_UL320_.jpg,False,AMZ
zapatillas,Gresca Zapatillas de fútbol Unisex Adulto Negro 42 EU,Munich,52.15,35.0,4.4,26,https://m.media-amazon.com/images/I/81bYN9yykZL._AC_UL320_.jpg,True,AMZ
zapatillas,515 Zapatillas Hombre,New Balance,52.5,42.0,4.6,2866,https://m.media-amazon.com/images/I/61PN8kiEn9L._AC_UL320_.jpg,True,AMZ
zapatillas,Woodburn II Chukka WP Omni-Heat Botas de Senderismo Hombre,Columbia,76.0,37.0,4.5,875,https://m.media-amazon.com/images/I/71Y7HDd3A3L._AC_UL320_.jpg,True,AMZ
zapatillas,U Symbol Zapatillas Hombre,Geox,66.3,34.0,4.6,4960,https://m.media-amazon.com/images/I/71Hqy1DZiDL._AC_UL320_.jpg,True,AMZ
zapatillas,Woodward 2.0 Zapatillas Hombre,Levi's,47.95,20.0,4.4,159,https://m.media-amazon.com/images/I/71k2fzOCTbL._AC_UL320_.jpg,True,AMZ
zapatillas,42562 Zapatillas Mujer,XTI,29.95,0,4.5,19,https://m.media-amazon.com/images/I/81wXBUH63TL._AC_UL320_.jpg,True,AMZ
zapatillas,Zapatos para Correr Hombres Mujeres Zapatillas de Deporte Zapatos Deportivos Moda Ligero Zapatos Transpirables Casuales,VVQI,33.99,0,4.2,598,https://m.media-amazon.com/images/I/71dh3tgDNSL._AC_UL320_.jpg,True,AMZ
zapatillas,Zapatillas de Tela de Fieltro Confort para Hombre,ZIZOR,16.99,0,3.9,21,https://m.media-amazon.com/images/I/81Vqda8r7AL._AC_UL320_.jpg,False,AMZ
zapatillas,Zapatillas de Seguridad Hombre Mujer Zapatos de Seguridad con Punta de Acero Comodo Ligeras Calzado de Seguridad Deportivo,DYKHMILY,47.9,0,3.9,305,https://m.media-amazon.com/images/I/715CNKdICNL._AC_UL320_.jpg,True,AMZ
zapatillas,Deslizador Deslizadores Ligeros de tamaño 36-51,Pantoffelmann,25.81,0,4.1,195,https://m.media-amazon.com/images/I/81QiPRN9rsL._AC_UL320_.jpg,False,AMZ
zapatillas,Unisex Ligero Zapatillas de Deporte para Niños Niñas Sneakers Transpirable Cómodos Zapatos Casuales 26-38 EU,Mishansha,31.44,15.0,4.1,1246,https://m.media-amazon.com/images/I/71RoVslIQAL._AC_UL320_.jpg,True,AMZ
zapatillas,Zapatillas Hombre Casual ElisForm. Sneakers,elis,35.99,40.0,3.6,69,https://m.media-amazon.com/images/I/61NLij2lREL._AC_UL320_.jpg,True,AMZ
zapatillas,Zapatillas de Seguridad Hombre Mujer Zapatos de Seguridad con Punta de Acero Comodo Ligeras Calzado de Seguridad Deportivo,DYKHMILY,47.9,0,3.9,305,https://m.media-amazon.com/images/I/715CNKdICNL._AC_UL320_.jpg,True,AMZ
zapatillas,Zapatos Deporte Mujer Zapatillas Deportivas Correr Gimnasio Casual Zapatos para Caminar Mesh Running Transpirable Aumentar Más Altos Sneakers Negro Gris Morado Rojo 35-44,Rioneo,23.99,0,4.2,4030,https://m.media-amazon.com/images/I/61SipI8Jq2L._AC_UL320_.jpg,False,AMZ
zapatillas,Marabu Unisex Zapatillas Hombre,Kappa,26.95,10.0,4.4,123,https://m.media-amazon.com/images/I/41ORIseXSfS._AC_UL320_.jpg,False,AMZ
zapatillas,Track-scloric 52631-bkrd Zapatillas Hombre,Skechers,42.98,31.0,4.5,2334,https://m.media-amazon.com/images/I/81FAZrs8JIS._AC_UL320_.jpg,False,AMZ
zapatillas,Defy All Day Zapatillas Deportivas Hombre,NIKE,59.95,0,4.1,12,https://m.media-amazon.com/images/I/71DR0fhVyYL._AC_UL320_.jpg,True,AMZ
zapatillas,42562 Zapatillas Mujer,XTI,29.95,0,4.5,19,https://m.media-amazon.com/images/I/81wXBUH63TL._AC_UL320_.jpg,True,AMZ
zapatillas,Terrex Swift Solo Walking Shoe Hombre,adidas,70.95,29.0,4.2,4650,https://m.media-amazon.com/images/I/71EJcShrmYL._AC_UL320_.jpg,True,AMZ
zapatillas,52635 Zapatillas Deportivas Hombre,Skechers,48.48,3.0,4.5,3913,https://m.media-amazon.com/images/I/61a6HZVJtGL._AC_UL320_.jpg,True,AMZ
zapatillas,Tijuana Zapatillas Mujer,Levi's,38.6,23.0,4.0,1382,https://m.media-amazon.com/images/I/612jfWgS6XL._AC_UL320_.jpg,True,AMZ
zapatillas,Filmore Hi Canvas Zapatillas Mujer,Vans,60.85,24.0,4.7,98,https://m.media-amazon.com/images/I/81nggoKw46L._AC_UL320_.jpg,True,AMZ
zapatillas,U Old SKOOL Black/coffeebn VKW6LJG - Zapatillas de Ante Unisex,Vans,61.66,12.0,4.6,11704,https://m.media-amazon.com/images/I/714C06NCeML._AC_UL320_.jpg,True,AMZ
zapatillas,Strada Wmn Zapatilla Mujer,Fila,55.34,31.0,4.3,1525,https://m.media-amazon.com/images/I/61PHziTWd5L._AC_UL320_.jpg,True,AMZ
zapatillas,Originals Superstar Zapatillas de Gimnasia Hombre,adidas,89.99,10.0,4.6,3908,https://m.media-amazon.com/images/I/81EOvKGKeeL._AC_UL320_.jpg,True,AMZ
zapatillas,Cl Nylon Zapatillas de Trail Running Hombre,Reebok,31.62,51.0,4.7,291,https://m.media-amazon.com/images/I/615n1QQfnOL._AC_UL320_.jpg,True,AMZ
zapatillas,Abbey Esse Zapatillas Mujer,Pepe Jeans,21.0,6.0,5.0,3,https://m.media-amazon.com/images/I/71LSbBJC1PL._AC_UL320_.jpg,False,AMZ
zapatillas,U Wells C Zapatillas Hombre,Geox,54.05,46.0,4.6,2436,https://m.media-amazon.com/images/I/71raqEV4HjL._AC_UL320_.jpg,True,AMZ
zapatillas,OG 85-Old School Cool Zapatillas Mujer,Skechers,46.95,22.0,4.3,1188,https://m.media-amazon.com/images/I/81IImYnAx0L._AC_UL320_.jpg,True,AMZ
zapatillas,Skien Zapatillas Mujer,GIOSEPPO,48.95,30.0,5.0,13,https://m.media-amazon.com/images/I/61lMnKMLPvL._AC_UL320_.jpg,True,AMZ
zapatillas,43661 Zapatillas Mujer,XTI,39.95,0,4.1,4,https://m.media-amazon.com/images/I/51JVp4rjIPL._AC_UL320_.jpg,False,AMZ
zapatillas,Plataforma VICTORIA BOTÍN Tribu Doble Lona 1061101-WOMEN para Mujer,victoria,39.9,0,4.6,681,https://m.media-amazon.com/images/I/51hEw--AHgL._AC_UL320_.jpg,True,AMZ
zapatillas,Rebound Future EVO Zapatillas Deportivas Unisex Adulto,PUMA,25.23,66.0,4.5,82,https://m.media-amazon.com/images/I/81yeyRUfjgL._AC_UL320_.jpg,False,AMZ
zapatillas,Trail Light Urban 21 Zapatillas Hombre,Pepe Jeans,63.99,0,2.0,1,https://m.media-amazon.com/images/I/81GrolC4SSL._AC_UL320_.jpg,True,AMZ
zapatillas,H2285arlow 1d Zapatillas Hombre,Tommy Hilfiger,47.95,20.0,4.3,1380,https://m.media-amazon.com/images/I/612lnWartlL._AC_UL320_.jpg,True,AMZ
zapatillas,Bobs Squad Tough Talk Zapatillas Mujer,Skechers,43.92,12.0,4.5,7566,https://m.media-amazon.com/images/I/71NCmRt2-2L._AC_UL320_.jpg,True,AMZ
zapatillas,Woods W Zapatillas Mujer,Levi's,49.95,17.0,4.3,684,https://m.media-amazon.com/images/I/61oGnJbp4pL._AC_UL320_.jpg,True,AMZ
zapatillas,Cora Poppy Black,Clarks,34.99,5.0,3.1,7,https://m.media-amazon.com/images/I/514s0S1crTL._AC_UL320_.jpg,False,AMZ
zapatillas,Low Top Canvas Classic Navy Ribbon,El Ganso,69.9,0,5.0,1,https://m.media-amazon.com/images/I/51rJhAbiT1L._AC_UL320_.jpg,False,AMZ
zapatillas,Sandalias de Niño Niña Punta Cerrada Verano Zapatos de Pescador para Exteriores Playa,wyhweilong,28.99,0,4.1,61,https://m.media-amazon.com/images/I/61HWUgw84sL._AC_UL320_.jpg,False,AMZ
zapatillas,Zapatillas Deportivas de Mujer Zapatos Running Fitness Gym Outdoor Sneaker Casual Mesh Transpirable Comodas Rojas Calzado Azul Negro Azul Rosa Caqui Blanca Talla 35-44,Hitmars,28.99,0,4.2,3198,https://m.media-amazon.com/images/I/61N2ZeUDa+L._AC_UL320_.jpg,False,AMZ
zapatillas,Revolution 6 Nn Zapatillas para Correr Hombre,NIKE,48.59,19.0,4.4,268,https://m.media-amazon.com/images/I/81piWyfMXHL._AC_UL320_.jpg,True,AMZ
zapatillas,Smash Wns V2 L Zapatillas Mujer,PUMA,35.29,29.0,4.4,16699,https://m.media-amazon.com/images/I/41SI3vtSPmL._AC_UL320_.jpg,True,AMZ
zapatillas,GS Jet Zapatillas de Baloncesto Unisex Adulto Versa Rojo/Blanco/Beta (602) 36 EU,Under Armour,41.44,0,4.5,9,https://m.media-amazon.com/images/I/710eXo9lMKL._AC_UL320_.jpg,True,AMZ
zapatillas,Royal Glide Zapatillas de Deporte Mujer,Reebok,50.89,22.0,4.4,977,https://m.media-amazon.com/images/I/61QpVhSY1QL._AC_UL320_.jpg,True,AMZ
zapatillas,Continental Botas de fútbol Hombre,Munich,38.25,38.0,4.3,605,https://m.media-amazon.com/images/I/71hrSOZrJsL._AC_UL320_.jpg,True,AMZ
zapatillas,Plataforma VICTORIA BOTÍN Tribu Doble Efecto Piel 1061107-KIDS para Niñas,victoria,39.4,0,4.6,557,https://m.media-amazon.com/images/I/81V3g4U7szL._AC_UL320_.jpg,True,AMZ
zapatillas,Handball Spezial Zapatillas de Gimnasia Hombre,adidas,30.0,70.0,4.7,536,https://m.media-amazon.com/images/I/71av7w-vszL._AC_UL320_.jpg,False,AMZ
zapatillas,Victory Zapatos para Correr Hombre,Under Armour,35.97,40.0,2.0,1,https://m.media-amazon.com/images/I/714gLclIO0S._AC_UL320_.jpg,True,AMZ
zapatillas,Quest 4 Zapatillas para Correr Mujer,NIKE,57.31,24.0,4.3,19,https://m.media-amazon.com/images/I/71b6lypdJsL._AC_UL320_.jpg,True,AMZ
zapatillas,U Old SKOOL Black/White Zapatillas Hombre,Vans,59.5,21.0,4.6,24144,https://m.media-amazon.com/images/I/71CGnkZRheL._AC_UL320_.jpg,True,AMZ
zapatillas,Amot Zapatillas Mujer,GIOSEPPO,34.7,47.0,5.0,2,https://m.media-amazon.com/images/I/714cHpsHchL._AC_UL320_.jpg,True,AMZ
zapatillas,Ination Wmn Zapatilla Mujer,Fila,21.18,65.0,4.3,16,https://m.media-amazon.com/images/I/81LvTFQpAdL._AC_UL320_.jpg,False,AMZ
zapatillas,Gresca Zapatillas Unisex Adulto,Munich,54.6,32.0,4.3,146,https://m.media-amazon.com/images/I/71Mx9L4NVHL._AC_UL320_.jpg,True,AMZ
zapatillas,Disruptor Wmn Zapatilla Mujer,Fila,71.99,28.0,4.5,6322,https://m.media-amazon.com/images/I/616K5O3M52L._AC_UL320_.jpg,True,AMZ
zapatillas,Oats Zapatillas Hombre,Levi's,41.28,45.0,4.5,281,https://m.media-amazon.com/images/I/819+xHvteaS._AC_UL320_.jpg,True,AMZ
zapatillas,52183 Zapatillas con Velcro Hombre,Skechers,66.42,5.0,4.6,767,https://m.media-amazon.com/images/I/61ONQtbTidL._AC_UL320_.jpg,True,AMZ
zapatillas,43236 Zapatillas Mujer,XTI,31.1,38.0,4.1,37,https://m.media-amazon.com/images/I/81-DFdKbd5L._AC_UL320_.jpg,True,AMZ
zapatillas,Smash V2 L - Zapatillas Bajas Unisex-Adulto Blanco (White Puma White Puma White) 43 EU Par,PUMA,43.87,12.0,4.5,1224,https://m.media-amazon.com/images/I/61TubS5f1AL._AC_UL320_.jpg,True,AMZ
zapatillas,Originals OG 85 Goldn Gurl Zapatillas Mujer,Skechers,52.0,13.0,4.4,3061,https://m.media-amazon.com/images/I/713ZxordQeL._AC_UL320_.jpg,True,AMZ
zapatillas,U Aerantis B Zapatillas Hombre,Geox,40.01,71.0,4.0,11,https://m.media-amazon.com/images/I/71kH1AxhiHL._AC_UL320_.jpg,True,AMZ
zapatillas,Brady W Basic Zapatillas Mujer,Pepe Jeans,40.99,4.0,4.6,4,https://m.media-amazon.com/images/I/31tH7+in3-L._AC_UL320_.jpg,False,AMZ
zapatillas,Smash V2 Mid WTR SD Zapatillas Unisex Adulto,PUMA,24.12,66.0,4.5,40,https://m.media-amazon.com/images/I/61Gn7+R0U7L._AC_UL320_.jpg,False,AMZ
zapatillas,Mujer Zapatillas de Deporte Malla Air Cuña Cómodos Sneakers Mujer Casual Running Senderismo Ligero Mesh Zapatillas Gris Negro 35-41,Sisttke,29.95,0,4.2,827,https://m.media-amazon.com/images/I/51iUcnGfCmL._AC_UL320_.jpg,True,AMZ
zapatillas,Zapatillas Mujer Casa Cómodas Zapatillas Casa Mujer Invierno Cálidas Pantuflas Zapatillas de Casa para Mujer,LIBERO ARCO,12.9,0,5.0,3,https://m.media-amazon.com/images/I/61gPcAujOKL._AC_UL320_.jpg,False,AMZ
zapatillas,Zapatillas Sneakers Hombre ElisComfort Casual Deporte y Gimnasio,elis,64.99,0,4.7,22,https://m.media-amazon.com/images/I/71U+Ax0P2QS._AC_UL320_.jpg,True,AMZ
zapatillas,Unisex Ligero Zapatillas de Deporte para Niños Niñas Sneakers Transpirable Cómodos Zapatos Casuales 26-38 EU,Mishansha,31.44,15.0,4.1,1246,https://m.media-amazon.com/images/I/71RoVslIQAL._AC_UL320_.jpg,True,AMZ
zapatillas,Zapatillas Hombre Casual ElisForm. Sneakers,elis,35.99,40.0,3.6,69,https://m.media-amazon.com/images/I/61NLij2lREL._AC_UL320_.jpg,True,AMZ
zapatillas,Zapatillas de Seguridad Hombre Mujer Zapatos de Seguridad con Punta de Acero Comodo Ligeras Calzado de Seguridad Deportivo,DYKHMILY,47.9,0,3.9,305,https://m.media-amazon.com/images/I/715CNKdICNL._AC_UL320_.jpg,True,AMZ
zapatillas,Sandalias de Niño Niña Punta Cerrada Verano Zapatos de Pescador para Exteriores Playa,wyhweilong,28.99,0,4.1,61,https://m.media-amazon.com/images/I/61HWUgw84sL._AC_UL320_.jpg,False,AMZ
zapatillas,Smash V2 Zapatillas Unisex Adulto,PUMA,45.99,16.0,4.5,20181,https://m.media-amazon.com/images/I/613wrEfsdBL._AC_UL320_.jpg,True,AMZ
zapatillas,Slam Zapatos de Tenis Hombre,JOMA,77.99,0,4.5,89,https://m.media-amazon.com/images/I/61SZDya+1jL._AC_UL320_.jpg,False,AMZ
zapatillas,Lite 2.0 Zapatillas de Running Hombre,Reebok,40.0,0,4.7,14,https://m.media-amazon.com/images/I/712zKeDt0qL._AC_UL320_.jpg,True,AMZ
zapatillas,Follow OC XL Zapatillas Unisex Adulto,Kappa,31.59,10.0,4.3,538,https://m.media-amazon.com/images/I/51Tkf0bs6IL._AC_UL320_.jpg,True,AMZ
zapatillas,Turner 2.0 Zapatillas Hombre,Levi's,59.0,0,5.0,1,https://m.media-amazon.com/images/I/71RcNbtOm-L._AC_UL320_.jpg,True,AMZ
zapatillas,373 Core Zapatillas Hombre,New Balance,42.5,43.0,4.5,12621,https://m.media-amazon.com/images/I/71B8Z-otu-L._AC_UL320_.jpg,True,AMZ
zapatillas,Plataforma VICTORIA Basket Utopia Efecto Piel con Trasera DE Serraje Que SE PROLONGA 1260138-WOMEN para Mujer,victoria,49.63,0,3.0,1,https://m.media-amazon.com/images/I/51nnpkrnOGS._AC_UL320_.jpg,True,AMZ
zapatillas,Mapf1 X-Ray 2 Zapatillas Deportivas Unisex Adulto,PUMA,66.5,26.0,4.5,23,https://m.media-amazon.com/images/I/81+9VRv6C3L._AC_UL320_.jpg,True,AMZ
zapatillas,Gwloven Zapatillas Mujer,Guess,50.51,0,4.6,1015,https://m.media-amazon.com/images/I/61G83uQGUXL._AC_UL320_.jpg,True,AMZ
zapatillas,Tiempo Men Libre Zapatillas para Lacrosse Hombre,JOMA,31.5,10.0,5.0,3,https://m.media-amazon.com/images/I/41yJBJ2NURL._AC_UL320_.jpg,True,AMZ
zapatillas,Warisv3 Zapatillas para Correr de Carretera Mujer,New Balance,51.55,0,3.8,9,https://m.media-amazon.com/images/I/71N3xO02bfL._AC_UL320_.jpg,True,AMZ
zapatillas,Follow BC Zapatillas Unisex Adulto,Kappa,21.95,0,4.2,24,https://m.media-amazon.com/images/I/61rb6Uze-KL._AC_UL320_.jpg,False,AMZ
zapatillas,Fluidstreet Road Running Shoe Hombre,adidas,49.9,17.0,4.4,126,https://m.media-amazon.com/images/I/71jrCICn69L._AC_UL320_.jpg,True,AMZ
zapatillas,Imar Zapatillas Hombre,Camper,90.0,0,4.3,26,https://m.media-amazon.com/images/I/71un5BWvkJL._AC_UL320_.jpg,True,AMZ
zapatillas,Lite Racer Rebold Sneaker Hombre,adidas,52.74,0,4.7,11,https://m.media-amazon.com/images/I/71KlMgCWeqL._AC_UL320_.jpg,True,AMZ
zapatillas,Base II Zapatillas Unisex Adulto,Kappa,35.95,10.0,4.2,228,https://m.media-amazon.com/images/I/41UNfrRKtkS._AC_UL320_.jpg,True,AMZ
zapatillas,Essential Sneaker Zapatillas Mujer,Tommy Hilfiger,64.03,36.0,4.4,1383,https://m.media-amazon.com/images/I/61VZYSACpHL._AC_UL320_.jpg,True,AMZ
zapatillas,Wave Revolt Zapatillas Mujer,Mizuno,58.75,0,4.2,11,https://m.media-amazon.com/images/I/71drQYSGwYL._AC_UL320_.jpg,True,AMZ
zapatillas,Low Top Canvas Classic Navy Ribbon,El Ganso,69.9,0,5.0,1,https://m.media-amazon.com/images/I/51rJhAbiT1L._AC_UL320_.jpg,False,AMZ
zapatillas,Cora Poppy Black,Clarks,34.99,5.0,3.1,7,https://m.media-amazon.com/images/I/514s0S1crTL._AC_UL320_.jpg,False,AMZ
zapatillas,Mujer Zapatillas de Deporte Malla Air Cuña Cómodos Sneakers Mujer Casual Running Senderismo Ligero Mesh Zapatillas Gris Negro 35-41,Sisttke,29.95,0,4.2,827,https://m.media-amazon.com/images/I/51iUcnGfCmL._AC_UL320_.jpg,True,AMZ
zapatillas,Tudy Zapatillas Deportivas Mujer,Kappa,39.06,0,5.0,1,https://m.media-amazon.com/images/I/611vvIKq8fL._AC_UL320_.jpg,True,AMZ
zapatillas,Nrgy Comet Zapatillas para Correr de Carretera Unisex niños,PUMA,47.38,14.0,4.4,2015,https://m.media-amazon.com/images/I/71bGgdkFKfL._AC_UL320_.jpg,True,AMZ
zapatillas,UA Charged Engage Zapatillas Hombre,Under Armour,48.12,31.0,4.6,70,https://m.media-amazon.com/images/I/81M-v2wxnWL._AC_UL320_.jpg,True,AMZ
zapatillas,Flex Advantage 4.0 Woodland Zapatillas Hombre,Skechers,53.33,24.0,4.6,83,https://m.media-amazon.com/images/I/81y-KFl86-L._AC_UL320_.jpg,True,AMZ
zapatillas,Furore Vampa Men Zapatilla Hombre,Fila,33.93,52.0,4.8,6,https://m.media-amazon.com/images/I/81miBSmT+8L._AC_UL320_.jpg,True,AMZ
zapatillas,Bobs Squad 3 - Zapatillas Mujer,Skechers,38.96,40.0,4.6,136,https://m.media-amazon.com/images/I/81+IXPG1TGS._AC_UL320_.jpg,True,AMZ
zapatillas,Range Exp Zapatillas Mujer,Vans,68.2,0,4.5,54,https://m.media-amazon.com/images/I/71Tkq36nWFL._AC_UL320_.jpg,True,AMZ
zapatillas,Graduate Tri1 SMA Zapatillas Hombre,Lacoste,67.49,33.0,4.3,135,https://m.media-amazon.com/images/I/61eseiafWfL._AC_UL320_.jpg,False,AMZ
zapatillas,Lvl-up XT Moto Wn's Zapatillas de Entrenamiento Mujer,PUMA,33.5,66.0,4.3,21,https://m.media-amazon.com/images/I/71Irrh3pdwL._AC_UL320_.jpg,True,AMZ
zapatillas,Plano VICTORIA Basket Tribu Lona 106550-KIDS para Unisex-niños,victoria,30.54,0,4.3,1067,https://m.media-amazon.com/images/I/711w7oqePFL._AC_UL320_.jpg,True,AMZ
zapatillas,UA W Essential NM Zapatillas para Correr Mujer,Under Armour,38.97,40.0,5.0,4,https://m.media-amazon.com/images/I/81I2OPsZPiS._AC_UL320_.jpg,True,AMZ
zapatillas,Serie Victory Zapatillas de Atletismo Hombre,JOMA,32.99,34.0,5.0,4,https://m.media-amazon.com/images/I/61t4RpUd44L._AC_UL320_.jpg,True,AMZ
zapatillas,UA Old Skool Stacked Navy/True White para Adulto Unisex,Vans,75.99,0,4.8,44,https://m.media-amazon.com/images/I/51iv0lyhZ0L._AC_UL320_.jpg,False,AMZ
zapatillas,1-1-23750-26 Zapatillas Mujer,Tamaris,15.33,0,4.4,95,https://m.media-amazon.com/images/I/61ABzCNu2-L._AC_UL320_.jpg,False,AMZ
zapatillas,Topaz C3 Zapatilla de Deporte Unisex Adulto,Element,36.74,9.0,4.5,209,https://m.media-amazon.com/images/I/614p4Tt-c1L._AC_UL320_.jpg,True,AMZ
zapatillas,Better Foam Emerge 3D Zapatillas para Correr Hombre,PUMA,58.24,0,4.3,5,https://m.media-amazon.com/images/I/81Oqv-ObJrL._AC_UL320_.jpg,True,AMZ
zapatillas,Carnaby Bl21 1 SMA Zapatillas Hombre,Lacoste,72.11,31.0,4.8,32,https://m.media-amazon.com/images/I/51A7himZ-yL._AC_UL320_.jpg,True,AMZ
zapatillas,Sala CT Zapatilla de fútbol Sala White-Regal Blue-Tangerine Tango,Umbro,25.64,0,3.6,33,https://m.media-amazon.com/images/I/61Z2qnwvRmL._AC_UL320_.jpg,True,AMZ
zapatillas,Speedcourt Handball Shoe Hombre,adidas,50.0,0,4.3,204,https://m.media-amazon.com/images/I/61hmwl5LwYL._AC_UL320_.jpg,True,AMZ
zapatillas,112020260 Zapatillas Mujer,Tom Tailor,15.35,3.0,4.9,22,https://m.media-amazon.com/images/I/71ii4NV1mzL._AC_UL320_.jpg,False,AMZ
zapatillas,W Revolution 6 Nn Zapatillas para Correr Mujer,NIKE,36.57,0,4.4,133,https://m.media-amazon.com/images/I/71dmrDvvyVL._AC_UL320_.jpg,True,AMZ
zapatillas,Zapatillas Deportivas de Mujer Zapatos Running Fitness Gym Outdoor Sneaker Casual Mesh Transpirable Comodas Rojas Calzado Azul Negro Azul Rosa Caqui Blanca Talla 35-44,Hitmars,28.99,0,4.2,3198,https://m.media-amazon.com/images/I/61N2ZeUDa+L._AC_UL320_.jpg,False,AMZ
zapatillas,Zapatillas Mujer Casa Cómodas Zapatillas Casa Mujer Invierno Cálidas Pantuflas Zapatillas de Casa para Mujer,LIBERO ARCO,12.9,0,5.0,3,https://m.media-amazon.com/images/I/61gPcAujOKL._AC_UL320_.jpg,False,AMZ
zapatillas,Deslizador Deslizadores Ligeros de tamaño 36-51,Pantoffelmann,25.81,0,4.1,195,https://m.media-amazon.com/images/I/81QiPRN9rsL._AC_UL320_.jpg,False,AMZ
zapatillas,Zapatillas Sneakers Hombre ElisComfort Casual Deporte y Gimnasio,elis,64.99,0,4.7,22,https://m.media-amazon.com/images/I/71U+Ax0P2QS._AC_UL320_.jpg,True,AMZ
zapatillas,Lynx Zero Zapatillas Niños,DC Shoes,42.67,0,4.9,13,https://m.media-amazon.com/images/I/61nHnVIRbaL._AC_UL320_.jpg,True,AMZ
zapatillas,Pure High-Top Ev Zapatillas Niños,DC Shoes,46.75,0,4.5,45,https://m.media-amazon.com/images/I/71KcdF1707L._AC_UL320_.jpg,True,AMZ
zapatillas,Unisex Ligero Zapatillas de Deporte para Niños Niñas Sneakers Transpirable Cómodos Zapatos Casuales 26-38 EU,Mishansha,31.44,15.0,4.1,1246,https://m.media-amazon.com/images/I/71RoVslIQAL._AC_UL320_.jpg,True,AMZ
zapatillas,Zapatillas Hombre Casual ElisForm. Sneakers,elis,35.99,40.0,3.6,69,https://m.media-amazon.com/images/I/61NLij2lREL._AC_UL320_.jpg,True,AMZ
zapatillas,Tanjun Zapatillas Deportivas Mujer,NIKE,25.23,62.0,4.6,12657,https://m.media-amazon.com/images/I/71KbHjfHAPL._AC_UL320_.jpg,False,AMZ
zapatillas,Pacific Zapatillas Hombre,bugatti,31.37,0,4.2,31,https://m.media-amazon.com/images/I/71WsWQ6LRnS._AC_UL320_.jpg,True,AMZ
zapatillas,Core Vulc Suede Thm Zapatillas Hombre,Tommy Hilfiger,57.89,0,4.5,7,https://m.media-amazon.com/images/I/71At8-JNxmL._AC_UL320_.jpg,True,AMZ
zapatillas,574v2 Core Zapatillas Hombre,New Balance,59.95,33.0,4.5,4098,https://m.media-amazon.com/images/I/719sKewhJwL._AC_UL320_.jpg,True,AMZ
zapatillas,G-3 Profit Zapatillas de Deporte Unisex Adulto Negro 40 EU,Munich,64.95,0,3.9,23,https://m.media-amazon.com/images/I/51Ixy+ezO7L._AC_UL320_.jpg,False,AMZ
zapatillas,Carnaby EVO 0721 3 SMA Zapatillas Hombre,Lacoste,76.0,31.0,4.3,44,https://m.media-amazon.com/images/I/61V+ZNkF8IL._AC_UL320_.jpg,True,AMZ
zapatillas,Zapatilla Soft Negro Paredes Estrella Velcro - Velcro - Talla 43,Paredes,26.49,0,4.4,303,https://m.media-amazon.com/images/I/51N47s8OUiL._AC_UL320_.jpg,False,AMZ
zapatillas,Skien Zapatillas Mujer,GIOSEPPO,48.95,30.0,5.0,13,https://m.media-amazon.com/images/I/61lMnKMLPvL._AC_UL320_.jpg,True,AMZ
zapatillas,Strutter Zapatillas Hombre,adidas,43.69,21.0,4.3,3235,https://m.media-amazon.com/images/I/71RkOTpUl0L._AC_UL320_.jpg,True,AMZ
zapatillas,Graviton Pro Zapatillas Unisex Adulto,PUMA,31.55,58.0,4.7,31,https://m.media-amazon.com/images/I/71AFvscrFKS._AC_UL320_.jpg,True,AMZ
zapatillas,G-3 Profit Zapatillas de Deporte Unisex Adulto,Munich,67.79,0,4.7,9,https://m.media-amazon.com/images/I/81ISAtmGmtL._AC_UL320_.jpg,False,AMZ
zapatillas,Storm 96 Lo 0321 1 SMA Zapatillas Hombre,Lacoste,89.99,25.0,4.4,12,https://m.media-amazon.com/images/I/61NbqEE2BwL._AC_UL320_.jpg,True,AMZ
zapatillas,Rigel Low Trekking Shoe WP Zapatillas Deportivas para Interior Hombre,CMP,53.99,32.0,4.4,2037,https://m.media-amazon.com/images/I/71llNakcvfL._AC_UL320_.jpg,True,AMZ
zapatillas,Patriot 12 Zapatillas Hombre,Asics,50.95,0,4.4,167,https://m.media-amazon.com/images/I/812j9qWP1PL._AC_UL320_.jpg,True,AMZ
zapatillas,Warisv3 Zapatillas para Correr de Carretera Mujer,New Balance,50.95,0,3.8,9,https://m.media-amazon.com/images/I/61MQmN9-IUL._AC_UL320_.jpg,True,AMZ
zapatillas,Seddini Zapatillas Mujer,GIOSEPPO,62.32,17.0,5.0,1,https://m.media-amazon.com/images/I/71UXNfWdWuL._AC_UL320_.jpg,False,AMZ
zapatillas,Tazon 6 FM Zapatillas Hombre,PUMA,41.83,30.0,4.6,21549,https://m.media-amazon.com/images/I/71f0n3eR3LL._AC_UL320_.jpg,True,AMZ
zapatillas,Sigbo Zapatillas Unisex Adulto,Kappa,26.95,10.0,4.2,886,https://m.media-amazon.com/images/I/51xgaW8pKsL._AC_UL320_.jpg,False,AMZ
zapatillas,Tinker Zero 21 Zapatillas Hombre,Pepe Jeans,61.99,0,4.8,24,https://m.media-amazon.com/images/I/71xaPRAt1EL._AC_UL320_.jpg,True,AMZ
zapatillas,Royal Cl Jogger 3 Zapatillas Hombre,Reebok,41.99,16.0,4.3,177,https://m.media-amazon.com/images/I/61OkBUjD9SL._AC_UL320_.jpg,True,AMZ
zapatillas,Uno Stand On Air Zapatillas Hombre,Skechers,65.38,7.0,4.6,523,https://m.media-amazon.com/images/I/71t0qCJ+rfL._AC_UL320_.jpg,True,AMZ
zapatillas,Gresca Zapatillas de fútbol Unisex Adulto Negro 41 EU,Munich,54.6,32.0,4.3,23,https://m.media-amazon.com/images/I/81bYN9yykZL._AC_UL320_.jpg,True,AMZ
zapatillas,1-1-23750-26 Zapatillas Mujer,Tamaris,15.35,0,4.4,95,https://m.media-amazon.com/images/I/61ABzCNu2-L._AC_UL320_.jpg,False,AMZ
zapatillas,Originals Superstar Zapatillas de Gimnasia Hombre,adidas,89.99,10.0,4.6,3908,https://m.media-amazon.com/images/I/81EOvKGKeeL._AC_UL320_.jpg,True,AMZ
zapatillas,Zapatillas de Seguridad Hombre Mujer Zapatos de Seguridad con Punta de Acero Comodo Ligeras Calzado de Seguridad Deportivo,DYKHMILY,47.9,0,3.9,305,https://m.media-amazon.com/images/I/715CNKdICNL._AC_UL320_.jpg,True,AMZ
zapatillas,Low Top Canvas Classic Navy Ribbon,El Ganso,69.9,0,5.0,1,https://m.media-amazon.com/images/I/51rJhAbiT1L._AC_UL320_.jpg,False,AMZ
zapatillas,Cora Poppy Black,Clarks,34.99,5.0,3.1,7,https://m.media-amazon.com/images/I/514s0S1crTL._AC_UL320_.jpg,False,AMZ
zapatillas,Serie Vitaly Lady Zapatillas para Correr Mujer,JOMA,35.0,0,4.9,10,https://m.media-amazon.com/images/I/61SXKRRqtgL._AC_UL320_.jpg,False,AMZ
zapatillas,Onhaye Zapatillas Mujer,GIOSEPPO,39.9,33.0,4.4,111,https://m.media-amazon.com/images/I/81rOhUc8-iL._AC_UL320_.jpg,True,AMZ
zapatillas,Lite Plus 3.0 Zapatillas Hombre,Reebok,45.0,0,4.0,26,https://m.media-amazon.com/images/I/717ZzxplALL._AC_UL320_.jpg,True,AMZ
zapatillas,Rigel - Zapatos de Low Rise Senderismo Mujer,CMP,57.99,27.0,4.4,2219,https://m.media-amazon.com/images/I/81PJHYfAU6L._AC_UL320_.jpg,True,AMZ
